### ISSUE TITLE
Sporadic duplicates despite configuration for cxactly-once delivery

### ISSUE THREAD

**Issue by marcin-krystianc** [marcin-krystianc/KafkaPlayground#3]
Hi, it is possible to get duplicated messages in my Kafka topic, it happens despite configuring the producer for exactly once delivery.
It occurs sporadically, but it is moderately easy to reproduce. It happens during a partition leader change, where for some reason the producer epoch is also being incremented.
The essential configuration bits for the producer are:
```
--replication-factor=3
--min-isr=2
--config request.required.acks=-1
--config enable.idempotence=true
--config max.in.flight.requests.per.connection=5
```
<details>
  <summary><code>1561308, 15:37:11.655040, 192.168.65.3:65494->3.70.194.188:40001 - Kafka Produce v10 Request</code></summary>

```
Frame 1561308: 224 bytes on wire (1792 bits), 224 bytes captured (1792 bits)
Linux cooked capture v2
Internet Protocol Version 4, Src: 192.168.65.3, Dst: 3.70.194.188
Transmission Control Protocol, Src Port: 65494, Dst Port: 40001, Seq: 497486, Ack: 227864, Len: 152
Kafka (Produce v10 Request)
    Length: 148
    API Key: Produce (0)
    API Version: 10
    Correlation ID: 3564
    Client ID: rdkafka
    Tagged fields
    Transactional ID: [ Null ]
    Required Acks: Full ISR (-1)
    Timeout: 30000
    Topic (Name=my-topic-0188)
        Topic Name: my-topic-0188
        Partition (ID=0)
            Partition ID: 0
            Message Set
                Record Batch
                    Offset: 0
                    Message Size: 87
                    Leader Epoch: 0
                    Magic Byte: 2
                    CRC32: 0xe97ffa59
                    .... .... .... .000 = Compression Codec: None (0)
                    .... .... .... 0... = Timestamp Type: CreateTime (0)
                    .... .... ...0 .... = Transactional: Non-transactional (0)
                    .... .... ..0. .... = Control Batch: Data batch (0)
                    Last Offset Delta: 1
                    First Timestamp: Jan  1, 1970 00:06:44.-1728723327 UTC
                    Last Timestamp: Jan  1, 1970 00:06:44.-1728723293 UTC
                    Producer ID: 7078
                    Producer Epoch: 0
                    Base Sequence: 2704
                    Size: 2
                    Record
                        Record Attributes (reserved): 0
                        Timestamp: Jan 24, 2025 15:37:11.553000000 UTC
                        Offset: 0
                        Key: 00000000
                        Value: 0000000000000a90
                        Headers
                    Record
                        Record Attributes (reserved): 0
                        Timestamp: Jan 24, 2025 15:37:11.587000000 UTC
                        Offset: 1
                        Key: 00000000
                        Value: 0000000000000a91
                        Headers
            Tagged fields
        Tagged fields
    Tagged fields
```
</details>

<details>
  <summary><code>1566024, 15:37:12.623878, 3.70.194.188:40001->192.168.65.3:65494 - Kafka Produce v10 Response [Not Leader For Partition] </code></summary>

```
Kafka (Produce v10 Response)
    Length: 97
    Correlation ID: 3564
    [Request Frame: 1561308]
    [API Key: Produce (0)]
    [API Version: 10]
    Tagged fields
    Topic
        Topic Name: my-topic-0188
        Partitions
            Partition (ID=0, Offset=71229)
                Partition ID: 0
                Error: Not Leader For Partition (6)
                Offset: 71229
                Time: -1 (latest)
                Log Start Offset: 0
                Record Errors
                Error Message: [ Null ]
                Tagged fields
                    Field
                        Tag Value: 0x0000000000000000
                        Tag Data: 000000030000001200
        Tagged fields
    Throttle time: 0
    Tagged fields
        Field
            Tag Value: 0x0000000000000000
            Tag Data: 02000000030d332e37302e3139342e31383800009c430000
</details>

<details>
  <summary><code>1566591, 15:37:12.769799, 192.168.65.3:58732->3.70.194.188:40003 - Kafka Produce v10 Request
</code></summary>

```
Kafka (Produce v10 Response)
    Length: 97
    Correlation ID: 2474
    [Request Frame: 1566591]
    [API Key: Produce (0)]
    [API Version: 10]
    Tagged fields
    Topic
        Topic Name: my-topic-0188
        Partitions
            Partition (ID=0, Offset=-1)
                Partition ID: 0
                Error: Not Leader For Partition (6)
                Offset: -1
                Time: -1 (latest)
                Log Start Offset: -1
                Record Errors
                Error Message: [ Null ]
                Tagged fields
                    Field
                        Tag Value: 0x0000000000000000
                        Tag Data: 000000010000001100
        Tagged fields
    Throttle time: 0
    Tagged fields
        Field
            Tag Value: 0x0000000000000000
            Tag Data: 02000000010d332e37302e3139342e31383800009c410000
```
</details>
